title,ad_id,desc,city,country
Town Park Senior Gardener,5458477675,"1st Step Solutions have a requirement for an experienced Town Park Senior Gardener, based in Essex. Job Purpose: * To be responsible for assigned staff and high-quality maintenance of the Town Park. To ensure the work is carried out effectively, safely, with courtesy and according to contract specifications. To drive and be responsible for vehicles, plant and equipment. To be responsible for the safety of members of the public. To act as link liaison with supervisory and lead staff. To play an active role with volunteer team and supporting the tasks that they carry out in the Town Park. * Be responsible for direction of work on site and the work of assigned employees, temporary staff and trainees. * Maintain effective working relationship with assigned team including volunteers. * Liaise with lead officers, establishing key working relationships. * Take the lead and be responsible for the preparation of specialist horticultural areas, parkland and areas managed for biodiversity. * Interpret contract specifications, plans and other work instructions. * Be responsible for the maintenance and establishment of shrub beds, hedges, small trees and all other ornamental planting. * Be responsible for the maintenance and establishment of amenity grass. * Drive and be responsible for vehicles, plant and equipment. * Be responsible for health and safety working practices on site. * Undertake other duties as may reasonably be required commensurate with the grade, skills, knowledge and experience of the post. * Reporting to the Grounds Maintenance Supervisor. Responsible for the Town Park Gardener. Duties: * Direct work on site and the work of assigned employees, temporary staff and trainees and maintain effective working relationship with assigned team including volunteers. * Be responsible for the direction of assigned employees, temporary staff or trainees. * Assist supervisors in the identification of staff training and development needs to ensure staff have the skills and knowledge to carry out their duties. Assist with the personal reviews. * Work alongside the Town Park volunteers and other volunteer groups in the Park. * Inspire and assist with the coordination of organising garden volunteers to undertake tasks to fit their abilities and the needs and requirements of the garden. * Stand in for supervisor or other staff with similar duties during sickness and holidays or emergencies as required. * Support the Town Park Education and volunteer Officer in garden promotion and advocacy and in their absence act as a local spoke person. * Work with colleagues in other teams to ensure the smooth implementation of Town Park events. * Establish and maintain relationships with members of the public acting as a key lead on information about the park. * Take the lead and be responsible for the preparation of specialist horticultural areas, parkland and areas managed for biodiversity. * Develop an understanding of the management plan for the Town Park and the wider context of the Landscape Contract. * Assist in the planning and execution of these specialist areas to the highest appropriate standards, interpret contract specifications, plans and other work instructions. * Resolve site issues and provide information about the work being carried out and the wider context of the park. * Be the lead hand on the maintenance, restoration and layout of specialist horticultural areas. * Record key data of programmed and unprogrammed work. * Use IT skills to implement efficient management systems and records completing associated short reports and data performance associated paperwork. * Be responsible for the maintenance and establishment of shrub beds hedges, small trees and all other ornamental planting. To contribute to the maintenance and establishment of amenity grass. * Prepare ground for planting or seeding. Use rotovators or other machinery as necessary. Carry out appropriate aftercare to lead to successful establishment. * Contribute to the establishment and maintenance of bulb areas, annuals, perennials, and any areas of specialist horticultural interest. * Plant shrubs, hedging and trees utilising a range of techniques. * Install stakes and support structures. * Maintain established shrubs by pruning or cutting back to reduce size, promote flowering, regenerate growth and to remove damaged, diseased or dead wood. * Cut formal and informal hedges using shears, secateurs or long arm pruners. Use hedge trimmers, chainsaws as a licenced (NPTC) operator or other powered hand tools in order to maximise efficiency. * Prune appropriately. Clear branch wood and arisings from horticultural operations and process accordingly. * Clear arisings and deal with appropriately. Clear leaves, litter and rubbish from landscaped areas. * Control weeds in sward, shrub, flower bed, hedge areas and by mechanical and chemical means as appropriate. * Control weeds in hard surfaces using chemicals as a licensed PA1 and PA6 operator. * Cut grass on occasion and carry out cultural maintenance of grass. * Form and maintain edges to grass. * Take responsibility for vehicles or item of plant and be accountable for avoidable damage and wear. Be responsible for the security of the machine whilst at work. * Be aware of legal requirements and safety regulations in respect of the vehicle or item of plant. * Maintain records of plant use. * Carry out daily and prestart checks according to manufacturer's instructions. * Operate the machinery safely and effectively. * Understand and initiate safe working practices in relation to key risk assessments and ensure at all time that work practices are covered by the relevant risk assessments. * Maintain healthy and safe working practices, respond and take appropriate action in emergencies. * Record accidents promptly and accurately according to procedure. * Assist with the creation of new Risk Assessments in conjunction with the line management. * Put out signs, keep work areas clear and employ good husbandry whilst working. Inform members of the public. * Carry out prestart risk assessments. * Undertake other duties as may reasonably be required commensurate with the grade, skills, knowledge and experience of the post. Experience and Qualifications: Essential: * Good literacy & numeracy skills. * Horticultural qualification or equivalent experience. * Able to use IT systems, including Microsoft Office . * Have an awareness and understanding of COSHH. * Able to use herbicides PA1 & PA6. * Knowledge and understanding of health and safety. * Have an awareness of Equality and Diversity. * Plant identification, planting and pruning techniques. * Skilled user of powered hand tools and horticultural machinery. * Commercial gardening experience. * Good knowledge of horticultural operations. * Have an awareness of the legal requirements in respect of vehicles or items of plant. * Experience of working with volunteers. * Experience of managing gardener/s. * Good written and verbal communications skills. * Can use own initiative. * Willing to work as part of a team. * Able to work with volunteers, meeting with the general public. * Understands volunteers` needs and aspirations. * Full valid UK current driving licence. * Able to work in all weathers. * Neat and tidy appearance. * Be conscientious. Desirable: * RHS Level 3 Qualification. * Chainsaw certificate. no -- Principals only. Recruiters, please don’t contact this job advertiser. no -- Please, no phone calls about this job! no -- Reposting this message elsewhere is NOT OK.","Harlow, Harlow, Essex Ireland,",Ireland
Caretaker - Hyde GAA Grounds,5114010410,"Application Details Share Eligibility to participate on CE is generally linked to those who are years or over and in receipt of a qualifying social welfare payment for 1 year or more or 18 years and over for certain disadvantaged groupsour eligibility will have to be verified by the Departmentr> You can register your interest by selecting the -Register your interest- button or you can a case officer in your local Intreo Centrer> Applicants should supply suitable character references and be prepared to complete a Garda vetting application formr> Duties Caretaker required for The Hyde GAA Grounds, Roscommon Townuties:maintenance of the pitch, club house and groundsr> no -- Principals only. Recruiters, please don’t contact this job advertiser. no -- Please, no phone calls about this job! no -- Reposting this message elsewhere is NOT OK.",Roscommon Ireland,Ireland
Caretaker/Maintenance Person,5055812071,"Application Details Share Eligibility to participate on CE is generally linked to those who are years or over and in receipt of a qualifying social welfare payment for 1 year or more or 18 years and over for certain disadvantaged groupsour eligibility will have to be verified by the Departmentr> You can register your interest by selecting the -Register your interest- button or you can a case officer in your local Intreo Centrer> Applicants should supply suitable character references and be prepared to complete a Garda vetting application formr> Duties The position will be in the above areahis is a developmental opportunity, no experience is necessaryccredited training will be provided to support your careeruties will include painting, carpentry and general maintenance, general caretaking, opening and closing centre, setting up for events position availabletarting date will be 1st 2020ocation:CYMS Hall, Killorglinpplications quoting PPS Noo CE Supervisor - Aidan Clifford, KCYMS Management Ltd, Mill Road, Killorglin, Coerry or by o cymskillorglinmto office -9762053r> no -- Principals only. Recruiters, please don’t contact this job advertiser. no -- Please, no phone calls about this job! no -- Reposting this message elsewhere is NOT OK.",Killorglin Dromavally Kerry,Ireland
Caretaker/Cleaner,5055812072,"Application Details Share Eligibility to participate on CE is generally linked to those who are years or over and in receipt of a qualifying social welfare payment for 1 year or more or 18 years and over for certain disadvantaged groupsour eligibility will have to be verified by the Departmentr> You can register your interest by selecting the -Register your interest- button or you can a case officer in your local Intreo Centrer> Applicants should supply suitable character references and be prepared to complete a Garda vetting application formr> Duties The position will be in the above areahis is a developmental opportunity, no experience is necessaryccredited training will be provided to support your careeruties will include cleaning of main hall, snooker hall and meeting rooms, opening and closing centre, setting up for events position availabletarting date will be 14th 2020ocation:CYMS Hall, Killorglinpplications quoting PPS Noo CE Supervisor - Aidan Clifford, KCYMS Management Ltd, Mill Road, Killorglin, Coerry or by o cymskillorglinmto office -9762053r> no -- Principals only. Recruiters, please don’t contact this job advertiser. no -- Please, no phone calls about this job! no -- Reposting this message elsewhere is NOT OK.",Killorglin Dromavally Kerry,Ireland
GAA Sports Grounds Caretaker,5061691555,"Application Details Share Eligibility to participate on CE is generally linked to those who are years or over and in receipt of a qualifying social welfare payment for 1 year or more or 18 years and over for certain disadvantaged groupsour eligibility will have to be verified by the Departmentr> You can register your interest by selecting the -Register your interest- button or you can a case officer in your local Intreo Centrer> Applicants should supply suitable character references and be prepared to complete a Garda vetting application formr> Duties Caretaking of club house and grounds including small repairs, painting, cleaning, general maintenance and preparing for matchesr> no -- Principals only. Recruiters, please don’t contact this job advertiser. no -- Please, no phone calls about this job! no -- Reposting this message elsewhere is NOT OK.",V HY Portmagee Kerry,Ireland
Caretaker/Horticulture,5087343455,"Application Details Share Eligibility to participate on CE is generally linked to those who are years or over and in receipt of a qualifying social welfare payment for 1 year or more or 18 years and over for certain disadvantaged groupsour eligibility will have to be verified by the Departmentr> You can register your interest by selecting the -Register your interest- button or you can a case officer in your local Intreo Centrer> Applicants should supply suitable character references and be prepared to complete a Garda vetting application formr> Duties Caretaker/maintenance at St Senans GAA Club, Mountcoal, Listowel, Co Kerryuties to include Mowing of Pitch, Strimming, Weed Control, Upkeep of Grounds and Cleaning of Dressing Rooms and Club Rooms, All work associated with the upkeep of a busy GAA Clubr> no -- Principals only. Recruiters, please don’t contact this job advertiser. no -- Please, no phone calls about this job! no -- Reposting this message elsewhere is NOT OK.",Mountcoal Kerry Ireland,Ireland
Window Fabricator / Glazier,5107809494,"Share Window Fabricator/ Glazier REQUIRED Fabrication of windows and doors, duties to include cutting profile, assembly components, drilling, glazingorking in a fast efficient production lineust have at least 2 years experience in the Window & Door / Glazing Industry, Top Class workmanship, exceptional attention to detail and be an extremely competent individual who can work as part of a team / on their own initiativeExperience in dealing in all uPVC, Timber, Aluclad and Aluminium Windows & Doors systems is an Advantage, Construction & Technical knowledge Career Level Not Required Candidate Requirements Essential Minimum Experienced Required Years:2 Minimum Qualification:No QualificationDesirableAbility Skills:Manual, Skilled Trades Competency Skills:Manufacturing, Teamwork no -- Principals only. Recruiters, please don’t contact this job advertiser. no -- Please, no phone calls about this job! no -- Reposting this message elsewhere is NOT OK.",Ballydesmond Glencollins Lower Cork,Ireland
Caretaker/Maintenance Person,5109254791,"Application Details Share Eligibility to participate on CE is generally linked to those who are years or over and in receipt of a qualifying social welfare payment for 1 year or more or 18 years and over for certain disadvantaged groupsour eligibility will have to be verified by the Departmentr> You can register your interest by selecting the Register your interest button or you can a case officer in your local Intreo Centrer> Applicants should supply suitable character references and be prepared to complete a Garda vetting application formr> Duties The position will be in the above areahis is a developmental opportunity, no experience is necessaryccredited training will be provided to support your careeruties will include painting, carpentry and general maintenance, general caretaking, opening and closing centre, setting up for events position availabletarting date will be 1st 2020ocation:CYMS Hall, Killorglinpplications quoting PPS Noo CE Supervisor - Aidan Clifford, KCYMS Management Ltd, Mill Road, Killorglin, Coerry or by email to cymskillorglinmto office -9762053r> no -- Principals only. Recruiters, please don’t contact this job advertiser. no -- Please, no phone calls about this job! no -- Reposting this message elsewhere is NOT OK.",Killorglin Dromavally Kerry,Ireland
Caretaker Community Centre Castleisland,5114010530,"Application Details Share Eligibility to participate on CE is generally linked to those who are years or over and in receipt of a qualifying social welfare payment for 1 year or more or 18 years and over for certain disadvantaged groupsour eligibility will have to be verified by the Departmentr> You can register your interest by selecting the -Register your interest- button or you can a case officer in your local Intreo Centrer> Applicants should supply suitable character references and be prepared to complete a Garda vetting application formr> Duties Maintaining and sanitizing the buildingacilitating all activities associated with the centre no -- Principals only. Recruiters, please don’t contact this job advertiser. no -- Please, no phone calls about this job! no -- Reposting this message elsewhere is NOT OK.",Castleisland Knockananlig Kerry,Ireland
Landscaping Operative,5458474466,"Job description * Job Role: Soft landscaping * Salary: £22,000 - £26,000 Per Annum Responsibilities and Duties Based around London, on various sites to carry out soft landscaping projects to the best of your ability including turfing and planting. Qualifications and Skills * Must have previous background experience of carrying out commercial scale, construction site-based soft landscaping operations. * Complete tasks such as turfing, seeding and planting etc. * NVQ level 2 qualification in Landscaping industry * CSCS Card Benefits * Permanent position, PAYE, Holiday pay * To be part of a growing company * Pension Scheme * Training and development * Salary negotiable dependent on experience * Monday-Friday working hours To apply please contact: (phone number removed) or submit your CV no -- Principals only. Recruiters, please don’t contact this job advertiser. no -- Please, no phone calls about this job! no -- Reposting this message elsewhere is NOT OK.","London, London Ireland,",Ireland
Pipe Fitter,5458477012,"Discipline: Pipe Fitter Location: Winchester, Hampshire Rate of Pay: £19.00/hr PAYE + lodge allowance Hours: 45-50 hrs, Mon-Fri Start date: Immediate Duration: 4 months The Role: Our client currently requires additional Pipe Fitters on a water treatment plant near Winchester. Duties will include: • Working from drawings • Installing carbon steel pipework • Installing valves, brackets and pipe supports Requirements: • CSCS card with Pipe Fitting trade • EUSR water hygiene card • Competent working from isometric drawings About Us: Integrate Engineering Resources Ltd provides a dedicated recruitment service to the Engineering Construction sector. Our specialist recruitment activities range across all areas and include the appointment of all levels of professional into the Major Projects, CHP, Anaerobic Digestion, Combined Cycle Gas Turbine, Nuclear, Biomass, Energy from Waste, Food, Water Treatment and Wind industries throughout the UK and worldwide. no -- Principals only. Recruiters, please don’t contact this job advertiser. no -- Please, no phone calls about this job! no -- Reposting this message elsewhere is NOT OK.","Winchester, Winchester, Hampshire Ireland,",Ireland
Grounds Maintenance Operative/ Gardener,5458472553,"Grounds Maintenance Operatives/ Gardeners required to work with leading and ambitious grounds maintenance provider based in the Welwyn Garden City and the wider Hertfordshire region. Start date: ASAP Hours: Hours can vary from day to day depending on location of site, travel time paid. Minimum 40 hours Mon - Fri. Regular additional summer hours. Contract: March to October fixed-term contracts and permanent vacancies available Pay rate: £9.85 - £11.50 per hour dependant on the position and contract type Role: We are looking for a professional grounds maintenance operative/ gardener to lead a mobile team of two providing ground maintenance services within the Hertfordshire region. You will visit up to six commercial sites a day delivering high-quality grounds maintenance services including grass cutting, hedge/shrub pruning and weed removal/treatment. Benefits: Once taken on permanently the following company benefits will be applicable; Competitive salary, discretionary Christmas bonus, paid break time, regular additional summer hours, excellent opportunities for promotion, training and development (including annual reviews and PA1/PA6 spraying licences), pensions are available in line with prevailing legislation, Employee Assistance Programme, second opinion medical hotline, family day, death in service benefit is payable whilst commercially available, collaborative approach via regular team meetings and staff involvement. Interested? Call Sam Hayes on (phone number removed)/ / (phone number removed) or email no -- Principals only. Recruiters, please don’t contact this job advertiser. no -- Please, no phone calls about this job! no -- Reposting this message elsewhere is NOT OK.","Welwyn Garden City, Welwyn Garden City, Hertfordshire Ireland,",Ireland
Cnc Miller Setter Operator,5458478037,"Late shift - CNC Miller - Advanced Setter/operator The successful candidate must have at least 3 years CNC Milling experience using Heidenhain controls. Required to complete machine set ups, adhere to quality procedures and ensure all parts are finished in line with the companies high standards. Monday to Thursday 15.45 - 01.45 £17 - £20 per hour DOE no -- Principals only. Recruiters, please don’t contact this job advertiser. no -- Please, no phone calls about this job! no -- Reposting this message elsewhere is NOT OK.","Ferndown, Ferndown, Dorset Ireland,",Ireland
Soft Landscaper,5458476958,"Soft Landscaper Addlestone, Surrey £11.50 per hour (40 hours per week) Full time Our horticultural client maintain private, residential gardens in Surrey. Thanks to an increase in work they have new, full time vacancies for people who have the right attitude to learn and develop a career in gardening. A full, manual driving licence is preferred. Key Duties: * Flower bed maintenance including planting, pruning, mulching and weeding * Lawn and hedge cutting using petrol mowers and strimmers * For those with a licence, some driving of a 3.5tn company van from one location to another * Leaf clearance and general cleaning of garden spaces Essential Skills: * A willingness to learn with a good attitude * A good team player * The ability to build strong working relationships * Reliable and a good timekeeper * The ability to keep things strictly confidential For further details on this exciting, great new opportunity, please apply with your CV via the apply button or contact David at our Surrey office. no -- Principals only. Recruiters, please don’t contact this job advertiser. no -- Please, no phone calls about this job! no -- Reposting this message elsewhere is NOT OK.","Addlestone, Addlestone, Surrey Ireland,",Ireland
Farm Worker,5439934025,"Experienced Farm worker required to carry out the following duties; Herding of livestock Feeding of livestock Operate farm vehicles and machines General day to day farm work Good rate of pay available to candidate with the right level of experience no -- Principals only. Recruiters, please don’t contact this job advertiser. no -- Please, no phone calls about this job! no -- Reposting this message elsewhere is NOT OK.","Laois, Laois",Ireland
General Labourer,5236722476,"Ireland / Code: EP@E02075 JobbeschreibungYou will be required to assist in formwork, steel reinforcement, drainage, ducting and concreting along with other civil aspects. REQUIREMENTS CSCS card Civils experience Orange Hi-Viz clothing - long sleeved top, trousers, helmet, gloves glasses, steel toe capped safety boots (not riggers) & ear protection Fluent in English Teilen Teilen Tweet E-mail no -- Principals only. Recruiters, please don’t contact this job advertiser. no -- Please, no phone calls about this job! no -- Reposting this message elsewhere is NOT OK.",null,Ireland
Gardener,5244824544,"We are currently looking for a talented Gardener to join our growing team. This is an ideal role for someone with extensive experience in horticulture and who takes pride in their work. In the role of Gardner, you will be responsible for the day to day maintaining of our gardens and village greens. We expect that the successful candidate will be able to manage and coordinate Seasonal planting and perform duties such as hedge trimming, pruning of shrubs, planting, weeding etcYou should be capable of working on your own initiative and self-motivated, be willing to learn new skills, reliable and a trustworthy member of the team. We provide excellent opportunities, flexible hours, competitive salary and benefits. If you want to join a high performing team and have the buzz for the garden then we want to hear from you… no -- Principals only. Recruiters, please don’t contact this job advertiser. no -- Please, no phone calls about this job! no -- Reposting this message elsewhere is NOT OK.",Wicklow,Ireland
